ID,Titulo,Descripcion Simple,Informacion,Evaluaciones,Tipo,Precio,URL,Limpieza,Veracidad,Llegada,Comunicacion,Ubicacion,Calidad,Servicios,Localizacion
1200688382914319681,Magníficas vistas sobre la arena de la playa Wifi,"Alojamiento entero: piso en Guardamar de la Safor, España",6 viajeros ·  · 3 dormitorios ·  · 5 camas ·  · 2 baños,59 evaluaciones,A pie de playa,78 € ,https://www.airbnb.es/rooms/31709557?adults=1&category_tag=Tag%3A789&children=0&enable_m3_private_room=true&infants=0&pets=0&photo_id=661906598&search_mode=flex_destinations_search&check_in=2024-04-10&check_out=2024-04-16&source_impression_id=p3_1710967122_NkyB2WbSTggkWJEg&previous_page_section_name=1000,"Limpieza4,9","Veracidad4,9","Llegada5,0","Comunicación4,8","Ubicación4,9","Calidad4,8","Vistas al marVistas al marAcceso a la playa, primera líneaCocinaWifiAparcamiento gratuito en las instalacionesPiscina De uso compartidoAdmite mascotasNo disponible: Detector de monóxido de carbonoDetector de monóxido de carbonoNo disponible: Detector de humoDetector de humoMostrar los 61 servicios","Guardamar de la Safor, Comunidad Valenciana, EspañaLa playa de Guardamar de la Safor es muy tranquila y familiar, fue urbanizada hace menos de 20 años y está bien comunicada con las playas de Gandía y Denia.Mostrar más"
5375220911806434689,Melior-1E,"Alojamiento entero: piso en Calp, España",6 viajeros ·  · 2 dormitorios ·  · 3 camas ·  · 2 baños,8 evaluaciones,A pie de playa,83 € ,https://www.airbnb.es/rooms/37584336?adults=1&category_tag=Tag%3A789&children=0&enable_m3_private_room=true&infants=0&pets=0&photo_id=1419088652&search_mode=flex_destinations_search&check_in=2024-05-05&check_out=2024-05-10&source_impression_id=p3_1710967165_LxHg3sXSoW3PWPNi&previous_page_section_name=1000,"Limpieza4,9","Veracidad4,5","Llegada4,5","Comunicación4,8","Ubicación4,8","Calidad4,8",Vistas a la montañaWifiTVAscensorLavadoraAire acondicionadoMicroondasNo disponible: Detector de monóxido de carbonoDetector de monóxido de carbonoNo disponible: Detector de humoDetector de humoMostrar los 10 servicios,"Calp, España"
556517738340669403,VERALUX,"Alojamiento entero: piso en Benidorm, España",4 viajeros ·  · 2 dormitorios ·  · 3 camas ·  · 2 baños,20 evaluaciones,A pie de playa,70 € ,https://www.airbnb.es/rooms/46527977?adults=1&category_tag=Tag%3A789&children=0&enable_m3_private_room=true&infants=0&pets=0&photo_id=1097478211&search_mode=flex_destinations_search&check_in=2024-03-22&check_out=2024-03-27&source_impression_id=p3_1710967163_kKxkKQMTv6y6JX4B&previous_page_section_name=1000,"Limpieza3,5","Veracidad4,6","Llegada4,7","Comunicación4,8","Ubicación5,0","Calidad4,3","Acceso a la playa, primera líneaCocinaWifiZona para trabajarPiscina: uso De uso compartido, Exterior, disponible según la temporada, disponible en un horario específicoJacuzzi privadoAdmite mascotasTVNo disponible: Detector de monóxido de carbonoDetector de monóxido de carbonoNo disponible: Detector de humoDetector de humoMostrar los 31 servicios","Benidorm, Comunidad Valenciana, España1ª línea de playa de poniente. Bares, restaurantes, farmacias, estancos y tiendas en la zona.Mostrar más"
8800182335332003755,Isea Calpe,"Alojamiento entero: piso en Calp, España",4 viajeros ·  · 2 dormitorios ·  · 3 camas ·  · 2 baños,557 evaluaciones,A pie de playa,128 € ,https://www.airbnb.es/rooms/721277134871448378?adults=1&category_tag=Tag%3A789&children=0&enable_m3_private_room=true&infants=0&pets=0&photo_id=1495138219&search_mode=flex_destinations_search&check_in=2024-03-31&check_out=2024-04-05&source_impression_id=p3_1710967156_fzT8liu3i8tCTdKC&previous_page_section_name=1000,,,,,,,CocinaWifiPiscinaTVAscensorLavadoraAire acondicionadoSecador de peloNo disponible: Detector de monóxido de carbonoDetector de monóxido de carbonoNo disponible: Detector de humoDetector de humoMostrar los 18 servicios,"Calp, Comunidad Valenciana, España"
-5036294419472545696,"Apartamento luminoso, internet, Netflix","Alojamiento entero: apto. residencial en Grau i Platja, España",6 viajeros ·  · 2 dormitorios ·  · 6 camas ·  · 1 baño,64 evaluaciones,A pie de playa,85 € ,https://www.airbnb.es/rooms/50155790?adults=1&category_tag=Tag%3A789&children=0&enable_m3_private_room=true&infants=0&pets=0&photo_id=1195141353&search_mode=flex_destinations_search&check_in=2024-03-31&check_out=2024-04-05&source_impression_id=p3_1710967158_49JI3FTL95nFkw%2FM&previous_page_section_name=1000,"Limpieza4,9","Veracidad4,9","Llegada4,9","Comunicación4,9","Ubicación4,7","Calidad4,7","Vistas al marVistas al jardínAcceso a la playa, primera líneaCocinaWifiAparcamiento gratuito en las instalacionesPiscina: uso De uso compartido, disponible todo el año, disponible en un horario específicoTelevisión de alta definición de 42"" con NetflixNo disponible: Detector de monóxido de carbonoDetector de monóxido de carbonoNo disponible: Detector de humoDetector de humoMostrar los 58 servicios","Grau i Platja, Comunidad Valenciana, España"
3765214563568425932,Voramar 3 Playa Puerto de Sagunto,"Alojamiento entero: piso en Port de Sagunt, España",5 viajeros ·  · 2 dormitorios ·  · 4 camas ·  · 2 baños,8 evaluaciones,A pie de playa,98 € ,https://www.airbnb.es/rooms/920102069611458157?adults=1&category_tag=Tag%3A789&children=0&enable_m3_private_room=true&infants=0&pets=0&photo_id=1681778266&search_mode=flex_destinations_search&check_in=2024-04-26&check_out=2024-05-01&source_impression_id=p3_1710967159_ufBy1mjLPr%2B09SxL&previous_page_section_name=1000,"Limpieza4,8","Veracidad5,0","Llegada5,0","Comunicación5,0","Ubicación5,0","Calidad4,9","Vistas al marVistas al parqueAcceso a la playa, primera líneaCocinaWifiZona para trabajarAparcamiento gratuito en las instalacionesTVLavadoraNo disponible: Detector de humoDetector de humoMostrar los 23 servicios","Port de Sagunt, Comunidad Valenciana, EspañaSituado a 50 metros de la playa. Junto a todos los servicios, farmacia, centro de salud, cafeterías, restaurantes y zona de ocio.Además , los Jueves y Sábados , desde las 9:00 hasta las 13:30 puedes disfrutar del mercadillo callejero y comprar la fruta y verdura de los agricultores de la zona y encontrar alguna otra cosa interesante ya que es muy variado. ¡ No te lo pierdas ! . A 200 m del centro de localidad, a 5 km del centro histórico de Sagunto, y a 25 km de Valencia.Mostrar más"
2769223886427212663,Primera linea de playa adaptado movilidad reducida,"Alojamiento entero: piso en Benidorm, España",5 viajeros ·  · 3 dormitorios ·  · 4 camas ·  · 1 baño,16 evaluaciones,A pie de playa,94 € ,https://www.airbnb.es/rooms/44026735?adults=1&category_tag=Tag%3A789&children=0&enable_m3_private_room=true&infants=0&pets=0&photo_id=1408091021&search_mode=flex_destinations_search&check_in=2024-05-15&check_out=2024-05-22&source_impression_id=p3_1710967159_ysju4iSoRlpJiFuc&previous_page_section_name=1000,"Limpieza4,8","Veracidad4,8","Llegada4,9","Comunicación4,8","Ubicación5,0","Calidad4,6","Acceso a la playa, primera líneaCocinaWifi (25 Mbps)Aparcamiento gratuito en las instalacionesPiscinaTVLavadoraAire acondicionadoNo disponible: Detector de monóxido de carbonoDetector de monóxido de carbonoNo disponible: Detector de humoDetector de humoMostrar los 26 servicios","Benidorm, Comunidad Valenciana, España"
8689080550819187113,3) Amplia hab. a pasos de playa.,"Habitación en Donostia, España",1 cama ·  · Baño compartido,8 evaluaciones,A pie de playa,120 € ,https://www.airbnb.es/rooms/886186959137688064?adults=1&category_tag=Tag%3A789&children=0&enable_m3_private_room=true&infants=0&pets=0&photo_id=1693121021&search_mode=flex_destinations_search&check_in=2024-07-01&check_out=2024-07-06&source_impression_id=p3_1710967164_qidfEjBj9BLciHsf&previous_page_section_name=1000,"Limpieza4,5","Veracidad4,8","Llegada4,9","Comunicación4,8","Ubicación5,0","Calidad4,4",Cerradura en la puerta del dormitorioAcceso a la playaCocinaWifiZona para trabajarLavadoraSecador de peloFrigoríficoNo disponible: Detector de monóxido de carbonoDetector de monóxido de carbonoNo disponible: Detector de humoDetector de humoMostrar los 32 servicios,"Donostia, Euskadi, España"
-2498811209296481166,Una casa en primera línea de playa (VT-46948-V),"Alojamiento entero: piso en Playa, España",6 viajeros ·  · 3 dormitorios ·  · 4 camas ·  · 2 baños,54 evaluaciones,A pie de playa,104 € ,https://www.airbnb.es/rooms/28068305?adults=1&category_tag=Tag%3A789&children=0&enable_m3_private_room=true&infants=0&pets=0&photo_id=1262226739&search_mode=flex_destinations_search&check_in=2024-04-22&check_out=2024-04-27&source_impression_id=p3_1710967159_YMTAeDCN1IcJ4aoI&previous_page_section_name=1000,"Limpieza5,0","Veracidad5,0","Llegada5,0","Comunicación4,9","Ubicación4,9","Calidad4,9","Acceso a la playa, primera líneaCocinaWifiZona para trabajarAparcamiento gratuito en la calleTVLavadoraAire acondicionado centralizadoNo disponible: Detector de monóxido de carbonoDetector de monóxido de carbonoNo disponible: Detector de humoDetector de humoMostrar los 46 servicios","Playa, Comunidad Valenciana, España"
-266642410705035547,Amatista Beachfront Departamento,"Alojamiento entero: piso en Calpe, España",3 viajeros ·  · 1 dormitorio ·  · 1 cama ·  · 1 baño,31 evaluaciones,A pie de playa,80 € ,https://www.airbnb.es/rooms/41498026?adults=1&category_tag=Tag%3A789&children=0&enable_m3_private_room=true&infants=0&pets=0&photo_id=953072116&search_mode=flex_destinations_search&check_in=2024-05-14&check_out=2024-05-21&source_impression_id=p3_1710967156_zi2LJvNXjf7pYT0n&previous_page_section_name=1000,"Limpieza4,8","Veracidad4,8","Llegada5,0","Comunicación4,9","Ubicación4,9","Calidad4,7","Vistas a la montañaVistas al marAcceso a la playa, primera líneaCocinaWifi rápido (104 Mbps)Aparcamiento gratuito en las instalacionesPiscina De uso compartidoTVLavadora en el alojamiento (Gratis)No disponible: Detector de monóxido de carbonoDetector de monóxido de carbonoMostrar los 41 servicios","Calpe, Comunidad Valenciana, España"
-4718123168137545303,Playa Laga.,"Alojamiento entero: adosado en Ibarrangelu, España",3 viajeros ·  · 3 dormitorios ·  · 4 camas ·  · 1 baño,88 evaluaciones,A pie de playa,250 € ,https://www.airbnb.es/rooms/29453970?adults=1&category_tag=Tag%3A789&children=0&enable_m3_private_room=true&infants=0&pets=0&photo_id=601560965&search_mode=flex_destinations_search&check_in=2024-06-01&check_out=2024-06-06&source_impression_id=p3_1710967158_3rZ71chwfIOcchu2&previous_page_section_name=1000,"Limpieza4,8","Veracidad4,9","Llegada4,9","Comunicación5,0","Ubicación5,0","Calidad4,8","Vistas a la montañaVistas al marAcceso a la playa, primera líneaCocinaWifiAparcamiento gratuito en las instalacionesSauna privadaAdmite mascotasNo disponible: Detector de monóxido de carbonoDetector de monóxido de carbonoNo disponible: Detector de humoDetector de humoMostrar los 50 servicios","Ibarrangelu, Euskadi, EspañaLa playa de laga, es una zona tranquila con un bar restaurante mayoritariamente frecuentado por surfistas,... El establecimiento es famoso por sus pintxos, desayunos, meriendas de chocolate con pan tostado y parrilla (Permanece cerrado desde el 10 de Diciembre hasta el 1 de Febrero). La zona de rocas es espectacular pudiendo ir a la zona de cuevas (si  el mar lo permite) en piragua. Tambien hay opcion de paseos a caballo.Mostrar más"
-7152446916346451574,Moderna suite a la orilla del mar en Calpe,"Alojamiento entero: piso en Calp, España",3 viajeros ·  · 1 dormitorio ·  · 2 camas ·  · 1 baño,3 evaluaciones,A pie de playa,63 € ,https://www.airbnb.es/rooms/862318150301776628?adults=1&category_tag=Tag%3A789&children=0&enable_m3_private_room=true&infants=0&pets=0&photo_id=1622516754&search_mode=flex_destinations_search&check_in=2024-05-12&check_out=2024-05-17&source_impression_id=p3_1710967161_aC%2BX14F9A6%2FtYRgp&previous_page_section_name=1000,"Limpieza5,0","Veracidad5,0","Llegada5,0","Comunicación5,0","Ubicación5,0","Calidad5,0",Acceso a la playaCocinaWifiTVAscensorLavadoraAire acondicionadoBañeraNo disponible: Detector de monóxido de carbonoDetector de monóxido de carbonoNo disponible: Detector de humoDetector de humoMostrar los 41 servicios,"Calp, Comunidad Valenciana, EspañaCulp, Comunidad Valenciana, EspañaEl pequeño pueblo español de Calpe está encaramado en la costa de la Costa Blanca, cerca de las rocas de Reñón de Ifach. Aproximadamente a una hora en coche del aeropuerto de Alicante y a una hora y media del precioso aeropuerto de Valencia. Calpe es un moderno resort español que cumple con los más estrictos requisitos del público festivo. Durante la temporada puedes participar o ser un espectador de un gran número de vacaciones, desfiles, espectáculos y conciertos, la mayoría de los cuales se celebran al aire libre. Los museos están abiertos a los turistas durante todo el año, se celebran conciertos y actuaciones. La administración de Calpe hace mucho para unas vacaciones interesantes, informativas y emocionantes de España y Europa. España no es sólo la belleza de la naturaleza. La hermosa ecología y las playas bien mantenidas son apreciadas por los exigentes turistas europeos que prefieren alquilar villas y apartamentos aquí. La longitud de las playas de Calpe bolMostrar más"
6403198657774209700,Apartamento Rompeolas II,"Alojamiento entero: piso en Somo, España",4 viajeros ·  · 2 dormitorios ·  · 4 camas ·  · 1 baño,38 evaluaciones,A pie de playa,87 € ,https://www.airbnb.es/rooms/907416496860673843?adults=1&category_tag=Tag%3A789&children=0&enable_m3_private_room=true&infants=0&pets=0&photo_id=1668251605&search_mode=flex_destinations_search&check_in=2024-04-02&check_out=2024-04-07&source_impression_id=p3_1710967162_6vnotMMBGCH5qZ4A&previous_page_section_name=1000,"Limpieza5,0","Veracidad5,0","Llegada4,9","Comunicación4,9","Ubicación5,0","Calidad4,8","Vistas al perfil urbanoAcceso a la playa, primera línea (Público o compartido)CocinaWifiZona para trabajarAdmite mascotasTVAscensorNo disponible: Detector de monóxido de carbonoDetector de monóxido de carbonoNo disponible: Detector de humoDetector de humoMostrar los 69 servicios","Somo, Cantabria, EspañaEs un pueblo com mucha gastronomia lo mismo puede comer marisquito , arroces, pescados del cantabrico ricas almejas ..por ejemplo el restaurante Las Quevrantas ..que otras opciones mas economicas..mejicanos ...italianos..menu del dia..hamburgueserias..creperia heladerias, cervecerias y copas La Mar Salada y el orford..supermercados, tiendas de ropa, peluquerias y estetica y solarium con reserva Marios y Teresa Bordas cremas depilacion madajes pedicura uñas, ambulatorio medico, bancos, fotografiaMostrar más"
-8640707769563957898,Apartamento en primera línea,"Alojamiento entero: piso en Benicasim, España","5 viajeros ·  · 3 dormitorios ·  · 2,5 baños",45 evaluaciones,A pie de playa,83 € ,https://www.airbnb.es/rooms/825889066022745754?adults=1&category_tag=Tag%3A789&children=0&enable_m3_private_room=true&infants=0&pets=0&photo_id=1602402043&search_mode=flex_destinations_search&check_in=2024-04-25&check_out=2024-04-30&source_impression_id=p3_1710967122_%2BRt9fq1WJQAj1Axh&previous_page_section_name=1000,"Limpieza4,9","Veracidad5,0","Llegada5,0","Comunicación4,9","Ubicación4,9","Calidad4,8",Vistas al marAcceso a la playaCocinaWifiZona para trabajarAparcamiento gratuito en un garaje residencial en la propiedad: 1 plazaAdmite mascotasTVAscensorNo disponible: Detector de monóxido de carbonoDetector de monóxido de carbonoMostrar los 40 servicios,"Benicasim, Comunidad Valenciana, España"
-1414555479123615510,4* - 3 Hab Rooftop Vista al mar Bellevue  Biarritz,"Alojamiento entero: apto. residencial en Biarritz, Francia",6 viajeros ·  · 3 dormitorios ·  · 4 camas ·  · 1 baño,22 evaluaciones,A pie de playa,180 € ,https://www.airbnb.es/rooms/47443378?adults=1&category_tag=Tag%3A789&children=0&enable_m3_private_room=true&infants=0&pets=0&photo_id=1238597127&search_mode=flex_destinations_search&check_in=2024-03-30&check_out=2024-04-06&source_impression_id=p3_1710967163_VLZ3c0STuSfGqW9B&previous_page_section_name=1000,"Limpieza4,6","Veracidad4,6","Llegada4,7","Comunicación4,9","Ubicación4,8","Calidad4,5","Vistas al marAcceso a la playa, primera líneaCocinaWifiAdmite mascotasTelevisión de alta definiciónAscensorLavadora en el alojamiento (Gratis)Secadora en el alojamiento (Gratis)No disponible: Detector de monóxido de carbonoDetector de monóxido de carbonoMostrar los 32 servicios","Biarritz, Nouvelle-Aquitaine, Francia"
-3322879440033785906,"Apartamento en calpe, Borumbot, próximo a la playa","Alojamiento entero: piso en Calp, España",4 viajeros ·  · 2 dormitorios ·  · 4 camas ·  · 2 baños,2 evaluaciones,A pie de playa,100 € ,https://www.airbnb.es/rooms/43531237?adults=1&category_tag=Tag%3A789&children=0&enable_m3_private_room=true&infants=0&pets=0&photo_id=1471425206&search_mode=flex_destinations_search&check_in=2024-06-16&check_out=2024-06-21&source_impression_id=p3_1710967156_IhAaBbfMMh548ShX&previous_page_section_name=1000,,,,,,,CocinaWifiZona para trabajarAparcamiento gratuito en las instalacionesPiscina De uso compartidoTelevisión con HBO MaxAscensorLavadora en el alojamiento (Gratis)Aire acondicionado centralizadoNo disponible: Detector de monóxido de carbonoDetector de monóxido de carbonoMostrar los 27 servicios,"Calp, Comunidad Valenciana, España"
2134403201690431677,Precioso apartamento en el puerto de Burriana,"Alojamiento entero: apto. residencial en Borriana, España",4 viajeros ·  · 3 dormitorios ·  · 3 camas ·  · 2 baños,30 evaluaciones,A pie de playa,,https://www.airbnb.es/rooms/44189859?adults=1&category_tag=Tag%3A789&children=0&enable_m3_private_room=true&infants=0&pets=0&photo_id=1087574106&search_mode=flex_destinations_search&check_in=2024-03-20&check_out=2024-03-25&source_impression_id=p3_1710967162_o%2Be4mXnskYuf5h8s&previous_page_section_name=1000,"Limpieza5,0","Veracidad5,0","Llegada5,0","Comunicación5,0","Ubicación4,8","Calidad4,8","Acceso a la playa, primera línea (Público o compartido)CocinaAparcamiento gratuito en las instalacionesTVAscensorLavadora en el alojamiento (Gratis)Aire acondicionado centralizadoBañeraNo disponible: Detector de monóxido de carbonoDetector de monóxido de carbonoNo disponible: Detector de humoDetector de humoMostrar los 45 servicios","Borriana, Comunidad Valenciana, EspañaSe puede ir andando al supermercado que se encuentra al final de la calle. Los servicios tipo farmacia, banco, panadería, tabaco también están a menos de 5 minutos andando del piso. El club náutico del puerto te permitirá practicar actividades como el paddle, kayak..Mostrar más"
5446267853190740821,Estudio en Muralla Roja - Muralla Roja 0504,"Alojamiento entero: piso en Calpe, España",2 viajeros ·  · 1 dormitorio ·  · 2 camas ·  · 1 baño,120 evaluaciones,A pie de playa,102 € ,https://www.airbnb.es/rooms/45007078?adults=1&category_tag=Tag%3A789&children=0&enable_m3_private_room=true&infants=0&pets=0&photo_id=1701904541&search_mode=flex_destinations_search&check_in=2024-03-24&check_out=2024-03-29&source_impression_id=p3_1710967163_ahYZbNbl7UpCyH2T&previous_page_section_name=1000,"Limpieza4,4","Veracidad4,3","Llegada4,6","Comunicación4,5","Ubicación4,9","Calidad4,0","Acceso a la playa, primera líneaCocinaWifiAparcamiento gratuito en la callePiscinaTVAire acondicionadoPatio o balcónNo disponible: Detector de monóxido de carbonoDetector de monóxido de carbonoNo disponible: Detector de humoDetector de humoMostrar los 18 servicios","Calpe, Comunidad Valenciana, España"
2195760240838344142,Apartamento Anfiteatro - Costa CarpeDiem,"Alojamiento entero: piso en Calpe, España",5 viajeros ·  · 3 dormitorios ·  · 3 camas ·  · 1 baño,407 evaluaciones,A pie de playa,,https://www.airbnb.es/rooms/34191806?adults=1&category_tag=Tag%3A789&children=0&enable_m3_private_room=true&infants=0&pets=0&photo_id=1327100964&search_mode=flex_destinations_search&check_in=2024-03-22&check_out=2024-03-27&source_impression_id=p3_1710967159_Qysph4%2FrkOonXHB0&previous_page_section_name=1000,"Limpieza4,8","Veracidad5,0","Llegada5,0","Comunicación5,0","Ubicación4,7","Calidad4,7",CocinaWifiAparcamiento gratuito en las instalacionesPiscinaAdmite mascotasTelevisión con televisión por cable estándarLavadoraAire acondicionadoNo disponible: Detector de monóxido de carbonoDetector de monóxido de carbonoNo disponible: Detector de humoDetector de humoMostrar los 26 servicios,"Calpe, Comunidad Valenciana, EspañaCalpe, Calpe, Costa BlancaMostrar más"
1444100291096625572,HABITACIONES MIRANDOALACONCHA (HABITACIÓN ZUBEROA 6),"Habitación privada en: hostal en Donostia, España",2 viajeros ·  · 1 dormitorio ·  · 1 cama ·  · 1 baño privado,130 evaluaciones,A pie de playa,150 € ,https://www.airbnb.es/rooms/51900373?adults=1&category_tag=Tag%3A789&children=0&enable_m3_private_room=true&infants=0&pets=0&photo_id=1244525770&search_mode=flex_destinations_search&check_in=2024-03-31&check_out=2024-04-05&source_impression_id=p3_1710967166_p5AXiX7K2B1rFbdO&previous_page_section_name=1000,"Limpieza4,6","Veracidad4,8","Llegada4,8","Comunicación4,5","Ubicación4,9","Calidad4,5",WifiZona para trabajarTVAscensorSecador de peloCámaras de seguridad en la propiedadMostrar los 12 servicios,"Donostia, Euskadi, España"
3203311963319915072,"Apartamento: WiFi rápido, playa, piscina, SmartTV","Alojamiento entero: apto. residencial en La Pobla de Farnals, España",2 viajeros ·  · 1 dormitorio ·  · 1 cama ·  · 1 baño,21 evaluaciones,A pie de playa,84 € ,https://www.airbnb.es/rooms/49523432?adults=1&category_tag=Tag%3A789&children=0&enable_m3_private_room=true&infants=0&pets=0&photo_id=1601790850&search_mode=flex_destinations_search&check_in=2024-04-07&check_out=2024-04-13&source_impression_id=p3_1710967167_VYhoRFvUPj7Mddjc&previous_page_section_name=1000,"Limpieza4,9","Veracidad4,8","Llegada4,9","Comunicación5,0","Ubicación4,5","Calidad4,5","Vistas al perfil urbanoVistas al jardínAcceso a la playa (Público o compartido)CocinaWifi rápido (458 Mbps)Aparcamiento gratuito en la entrada dentro de la propiedad: 1 plazaPiscina: uso De uso compartido, Exterior, disponible según la temporada, disponible en un horario específicoTelevisión de alta definición de 44"" con televisión por cable estándarNo disponible: Detector de monóxido de carbonoDetector de monóxido de carbonoNo disponible: Detector de humoDetector de humoMostrar los 42 servicios","La Pobla de Farnals, Comunidad Valenciana, EspañaEl apartamento está situado en La Playa de Pobla de Farnals (zona urbanizada - periferia norte de la ciudad de Valencia). Es una zona estival residencial tranquila, en los meses de verano con bastante ambiente familiar y de turismo español / europeo. Con restaurantes, cafeterías y heladerías. Supermercado Consum a 10 minutos caminando del apartamento.Mostrar más"
-5306769257719839751,Cala blanca Denia,"Alojamiento entero: piso en Denia, España",2 viajeros ·  · 1 dormitorio ·  · 1 cama ·  · 1 baño,546 evaluaciones,A pie de playa,85 € ,https://www.airbnb.es/rooms/884562701280690377?adults=1&category_tag=Tag%3A789&children=0&enable_m3_private_room=true&infants=0&pets=0&photo_id=1851109732&search_mode=flex_destinations_search&check_in=2024-04-01&check_out=2024-04-06&source_impression_id=p3_1710967161_CCIBff3CUyy7JFof&previous_page_section_name=1000,,,,,,,CocinaAparcamiento gratuito en las instalacionesPiscinaTVLavadoraAire acondicionadoPatio traseroSecador de peloNo disponible: Detector de monóxido de carbonoDetector de monóxido de carbonoNo disponible: Detector de humoDetector de humoMostrar los 18 servicios,"Denia, Comunidad Valenciana, España"
8034425628352167341,Medina Molins Lm-010,"Alojamiento entero: piso en Denia, España",4 viajeros ·  · 2 dormitorios ·  · 3 camas ·  · 2 baños,3 evaluaciones,A pie de playa,67 € ,https://www.airbnb.es/rooms/869269805497438103?adults=1&category_tag=Tag%3A789&children=0&enable_m3_private_room=true&infants=0&pets=0&photo_id=1627944999&search_mode=flex_destinations_search&check_in=2024-04-24&check_out=2024-04-29&source_impression_id=p3_1710967161_P33ESj3Eg4fWjhin&previous_page_section_name=1000,"Limpieza5,0","Veracidad5,0","Llegada4,7","Comunicación5,0","Ubicación5,0","Calidad4,3",Acceso a la playaCocinaAparcamiento gratuito en las instalacionesPiscina De uso compartidoAdmite mascotasTVLavadoraAire acondicionadoNo disponible: Detector de monóxido de carbonoDetector de monóxido de carbonoNo disponible: Detector de humoDetector de humoMostrar los 25 servicios,"Denia, Comunidad Valenciana, EspañaMostrar más"
7871387941752530170,Nova Altea. Primera linea playa. Relax.,"Alojamiento entero: piso en Altea, España","4 viajeros ·  · 2 dormitorios ·  · 2 camas ·  · 1,5 baños",34 evaluaciones,A pie de playa,109 € ,https://www.airbnb.es/rooms/7673525?adults=1&category_tag=Tag%3A789&children=0&enable_m3_private_room=true&infants=0&pets=0&photo_id=1020331950&search_mode=flex_destinations_search&check_in=2024-04-20&check_out=2024-04-25&source_impression_id=p3_1710967159_zTunSDlXLQgcIcaG&previous_page_section_name=1000,"Limpieza5,0","Veracidad5,0","Llegada5,0","Comunicación4,9","Ubicación4,7","Calidad4,8","Acceso a la playa, primera líneaCocinaWifiZona para trabajarAparcamiento gratuito en las instalacionesPiscinaTelevisión de alta definición de 42"" con televisión por cable estándarAscensorNo disponible: Detector de monóxido de carbonoDetector de monóxido de carbonoNo disponible: Detector de humoDetector de humoMostrar los 38 servicios","Altea, Comunidad Valenciana, España"
