ID,Titulo,Descripcion Simple,Informacion,Evaluaciones,Tipo,Precio,URL,Limpieza,Veracidad,Llegada,Comunicacion,Ubicacion,Calidad,Servicios,Localizacion
-3116953626790052479,"La Bicoque, cabaña atípica con red colgante cerca de Montpellier","Alojamiento entero: cabaña en Saint-Jean-de-Védas, Francia",3 viajeros ·  · 1 dormitorio ·  · 1 cama ·  · 1 baño,251 evaluaciones,Cabañas,75 € ,https://www.airbnb.es/rooms/12013119?adults=1&category_tag=Tag%3A5348&children=0&enable_m3_private_room=true&infants=0&pets=0&photo_id=1575832840&search_mode=flex_destinations_search&check_in=2024-03-21&check_out=2024-03-26&source_impression_id=p3_1710967239_tnkG5Wvg%2BKHbo0wq&previous_page_section_name=1000,"Limpieza5,0","Veracidad4,9","Llegada4,9","Comunicación4,9","Ubicación4,7","Calidad4,7",Vistas al valleCocinaWifiAparcamiento gratuito en las instalacionesTelevisión de alta definiciónAire acondicionado centralizadoPatio o balcón (privada)Parque/cunas de viajeBañera para bebésSecador de peloMostrar los 35 servicios,"Saint-Jean-de-Védas, Languedoc-Roussillon Midi-Pyrénées, FranciaSituado en Saint-Jean-de-Védas, el alojamiento goza de una ubicación privilegiada a las puertas de Montpellier y cerca de las playas. El mercado del centro de la ciudad, que se celebra dos veces por semana, permite hacer compras con productores locales.Mostrar más"
-8023294691694842837,Preciosa cabaña en las montañas,"Alojamiento entero: cabaña en Alicante, España",4 viajeros ·  · 2 dormitorios ·  · 4 camas ·  · 1 baño,14 evaluaciones,Cabañas,88 € ,https://www.airbnb.es/rooms/653500623506979606?adults=1&category_tag=Tag%3A5348&children=0&enable_m3_private_room=true&infants=0&pets=0&photo_id=1427687275&search_mode=flex_destinations_search&check_in=2024-06-01&check_out=2024-06-06&source_impression_id=p3_1710967235_zBpnc%2FKEW%2FlA3%2Fv%2B&previous_page_section_name=1000,"Limpieza4,8","Veracidad4,9","Llegada4,9","Comunicación5,0","Ubicación4,9","Calidad4,9",CocinaWifiZona para trabajarAparcamiento gratuito en las instalacionesAdmite mascotasTVLavadoraAire acondicionadoNo disponible: Detector de monóxido de carbonoDetector de monóxido de carbonoNo disponible: Detector de humoDetector de humoMostrar los 48 servicios,"Alicante, Comunidad Valenciana, EspañaTorremanzanas es originalmente un pueblo árabe de montaña que se encuentra en el interior de la Costa Blanca. El pueblo de montaña está situado a una altitud de 850 metros y tiene 660 habitantes.Es un lugar ideal para unas vacaciones tranquilas en familia. El pueblo está rodeado por una hermosa cadena montañosa donde se pueden realizar paseos con vistas espectaculares. No faltan rutas para senderistas, ciclistas y amantes del turismo. Una de las rutas del Camino de Santiago discurre traviesa por Torremanzanas.El pueblo es pequeño pero lleno de entretenimiento. Hay bares y restaurantes donde podrá disfrutar de la cocina típica española. Uno de los bares tiene música en vivo todos los viernes por la noche. Durante los meses de verano hay muchos fiestas locales donde jóvenes y mayores pueden divertirse juntos.Todos los domingos hay un mercado local en el pueblo donde puedes comprar productos típicos locales a un buen precio. El aceite de oliva elaborado en el pueblo es definitivamente recomendable.El pueblo tiene una ubicación céntrica y es ideal para excursiones de un día;Valencia 1,5 horas en cocheBenidorm, 50 minutos en cocheAlicante, 56 minutos en cocheAlcoy, 35 minutos en cocheXixona, a 20 minutos en coche.La playa más cercana es El Campello, a solo 45 minutos en coche. Es una hermosa playa con muchos bares y restaurantes. No hay turismo de masas aquí todavía.Ven a descubrir Torremanzanas y seguro que no te arrepentirás. ¡¡¡Te estamos esperando!!!Mostrar más"
-6013008780689565516,cabaña en medio de las montañas ideal para hacer senderismo,"Alojamiento entero: chalet en Saint-Lary, Francia",2 viajeros ·  · 1 dormitorio ·  · 1 cama ·  · 1 baño,27 evaluaciones,Cabañas,60 € ,https://www.airbnb.es/rooms/53120476?adults=1&category_tag=Tag%3A5348&children=0&enable_m3_private_room=true&infants=0&pets=0&photo_id=1278387689&search_mode=flex_destinations_search&check_in=2024-03-25&check_out=2024-04-01&source_impression_id=p3_1710967245_V3cWk08cU3C4TGlL&previous_page_section_name=1000,"Limpieza4,4","Veracidad4,7","Llegada4,8","Comunicación4,7","Ubicación4,8","Calidad4,6",Vistas a la montañaCocinaWifiZona para trabajarAparcamiento gratuito en las instalacionesAdmite mascotasTelevisión de alta definición con ChromecastLavadora en el alojamiento (Gratis)Patio o balcón (privada)No disponible: Detector de monóxido de carbonoDetector de monóxido de carbonoMostrar los 53 servicios,"Saint-Lary, Occitanie, Franciaentorno montañoso prever en invierno neumáticos adaptados a la nieve o cadenas o calcetines nevadas.La carretera se quita regularmenteAdvertencia: zona de montaña por lo tanto presencia de fauna y flora que debe conocer antes de reservar por favor. No se aceptarán reclamaciones debido a la presencia de animales ( ratas, serpientes, garrapatas, moscas, etc.) en el jardín.Ser respetuoso  con este entorno vivo con pleno conocimiento de causa es la garantía de una estancia exitosa. Te lo agradezcoMostrar más"
7948863079898020469,Amanita Treehouse Experience Gerês,"Casa del árbol en Caniçada, Portugal",2 viajeros ·  · 1 dormitorio ·  · 1 cama ·  · 1 baño,146 evaluaciones,Cabañas,99 € ,https://www.airbnb.es/rooms/43829815?adults=1&category_tag=Tag%3A5348&children=0&enable_m3_private_room=true&infants=0&pets=0&photo_id=1021004728&search_mode=flex_destinations_search&check_in=2024-06-01&check_out=2024-06-06&source_impression_id=p3_1710967223_UGCWD6UTGgn8N5O5&previous_page_section_name=1000,"Limpieza5,0","Veracidad5,0","Llegada5,0","Comunicación5,0","Ubicación5,0","Calidad4,9","WifiAparcamiento gratuito en las instalacionesPiscina De uso compartidoTelevisión de alta definición de 40"" con Amazon Prime Video, HBO MaxPatio o balcón (privada)Patio traseroChimenea interior: de pelletsCunaSecador de peloNo disponible: Detector de monóxido de carbonoDetector de monóxido de carbonoMostrar los 28 servicios","Caniçada, Braga, PortugalMostrar más"
-7430315758910850044,Cabaña Beach House,"Alojamiento entero: cabaña en Costa da Caparica, Portugal",8 viajeros ·  · 2 dormitorios ·  · 5 camas ·  · 1 baño,74 evaluaciones,Cabañas,200 € ,https://www.airbnb.es/rooms/5813867?adults=1&category_tag=Tag%3A5348&children=0&enable_m3_private_room=true&infants=0&pets=0&photo_id=1659804152&search_mode=flex_destinations_search&check_in=2024-05-12&check_out=2024-05-17&source_impression_id=p3_1710967243_kw3R1ixj8YK3rk7C&previous_page_section_name=1000,"Limpieza4,4","Veracidad4,4","Llegada4,7","Comunicación4,3","Ubicación4,8","Calidad4,2",Vistas al marVistas al marAcceso a la playaCocinaWifiAparcamiento gratuito en las instalacionesAdmite mascotasTVNo disponible: Detector de monóxido de carbonoDetector de monóxido de carbonoNo disponible: Detector de humoDetector de humoMostrar los 14 servicios,"Costa da Caparica, PortugalCornelia BeachMostrar más"
-5113833967147350443,El Monte Fuji - Cabañas y Spas las 7 Montañas,"Casa del árbol en Lourdes, Francia",5 viajeros ·  · 2 dormitorios ·  · 5 camas ·  · 1 baño,17 evaluaciones,Cabañas,210 € ,https://www.airbnb.es/rooms/602439328757355575?adults=1&category_tag=Tag%3A5348&children=0&enable_m3_private_room=true&infants=0&pets=0&photo_id=1386161587&search_mode=flex_destinations_search&check_in=2024-05-12&check_out=2024-05-17&source_impression_id=p3_1710967241_2S55TZtBJrzAtSs9&previous_page_section_name=1000,"Limpieza5,0","Veracidad4,7","Llegada4,5","Comunicación4,4","Ubicación4,8","Calidad4,5",Vistas a la montañaVistas al parqueCocinaZona para trabajarAparcamiento gratuito en las instalacionesPiscina De uso compartidoJacuzzi privadoLavadoraSecadoraNo disponible: Detector de monóxido de carbonoDetector de monóxido de carbonoMostrar los 29 servicios,"Lourdes, Occitanie, FranciaTe alojas en plena naturaleza en un espacio sin coche. Aparcamiento privado y seguro cerca. Desde su refugio, está a unos quince minutos a pie de los santuarios de Lourdes y la Cueva de Massabielle. Si prefiere una estancia 100% natural, utilice nuestra escalera para llegar al arroyo, al Gave y luego a las rutas de senderismo del Bosque de Lourdes. Reserva natural del Pibeste accesible en 5 minutos en coche.Mostrar más"
3817977826592186809,"Bungalow B2 | Naturaleza, playa y río","Alojamiento entero: bungalow en Fão, Portugal",4 viajeros ·  · 2 dormitorios ·  · 3 camas ·  · 1 baño,120 evaluaciones,Cabañas,143 € ,https://www.airbnb.es/rooms/21672110?adults=1&category_tag=Tag%3A5348&children=0&enable_m3_private_room=true&infants=0&pets=0&photo_id=853157699&search_mode=flex_destinations_search&check_in=2024-03-24&check_out=2024-03-29&source_impression_id=p3_1710967239_VDHwG3s4ByPdua0G&previous_page_section_name=1000,"Limpieza4,8","Veracidad4,9","Llegada5,0","Comunicación5,0","Ubicación4,9","Calidad4,8","Vistas al jardínVistas al resortAcceso a la playa, primera línea (Público o compartido)CocinaWifiZona para trabajarAparcamiento gratuito en las instalacionesPiscina: uso De uso compartido, Exterior, disponible según la temporada, disponible las 24 horas, de agua saladaNo disponible: Detector de monóxido de carbonoDetector de monóxido de carbonoNo disponible: Detector de humoDetector de humoMostrar los 66 servicios","Fão, Braga, PortugalSiempre debemos advertir a los huéspedes que nuestro Bungalow está situado en un espacio tranquilo con varias familias, muy acogedor y que siempre debemos respetar a los residentes. Deben prestar atención al ruido y cumplir con las normas y regulaciones del hotel y del espacio circundante. No está permitido hacer fuego y humo, y los lugares apropiados (para fumar están marcados).No se admiten mascotas en los bungalows ni en el espacio del hotel. Una alerta especial porque el Bungalow se inserta en un área protegida de la reserva natural donde no se permite hacer fuego y hacer basura y/o tirar basura al suelo se castiga con una multa.Mostrar más"
7089217193971962034,"T3 chalet, 2 dormitorios, Balcón, valle de St Lary","Alojamiento entero: piso en Vielle-Aure, Francia",5 viajeros ·  · 2 dormitorios ·  · 5 camas ·  · 1 baño,96 evaluaciones,Cabañas,42 € ,https://www.airbnb.es/rooms/13657508?adults=1&category_tag=Tag%3A5348&children=0&enable_m3_private_room=true&infants=0&pets=0&photo_id=1184679929&search_mode=flex_destinations_search&check_in=2024-03-30&check_out=2024-04-06&source_impression_id=p3_1710967242_D1AMIljiZfK7Iqx0&previous_page_section_name=1000,"Limpieza4,6","Veracidad4,8","Llegada4,9","Comunicación4,9","Ubicación4,8","Calidad4,8","Vistas a la montañaPista de esquí (Junto a una línea de transporte gratuito)CocinaWifiZona para trabajarAparcamiento gratuito en la propiedad: 1 plazaTelevisión de alta definición de 32"" con televisión por cable estándarLavadora en el alojamiento (Gratis)Aire acondicionado centralizadoPatio o balcón (privada)Mostrar los 58 servicios","Vielle-Aure, Occitanie, FranciaZona tranquila con aparcamiento privado!!Mostrar más"
8375505284448445261,Ascain/St Pée: 3*** vistas impresionantes! 8 p,"Alojamiento entero: vivienda en Saint-Pée-sur-Nivelle, Francia","8 viajeros ·  · 4 dormitorios ·  · 6 camas ·  · 2,5 baños",54 evaluaciones,Cabañas,190 € ,https://www.airbnb.es/rooms/26300892?adults=1&category_tag=Tag%3A5348&children=0&enable_m3_private_room=true&infants=0&pets=0&photo_id=1036577228&search_mode=flex_destinations_search&check_in=2024-03-23&check_out=2024-03-30&source_impression_id=p3_1710967236_AHY418nb%2FQ7pb%2B43&previous_page_section_name=1000,"Limpieza5,0","Veracidad5,0","Llegada4,9","Comunicación5,0","Ubicación5,0","Calidad4,9",CocinaWifiZona para trabajarAparcamiento gratuito en las instalacionesTVLavadora en el alojamiento (Gratis)Patio o balcón (privada)Patio trasero privado: Con valla en todo el perímetroChimenea interiorNo disponible: Detector de monóxido de carbonoDetector de monóxido de carbonoMostrar los 35 servicios,"Saint-Pée-sur-Nivelle, Nouvelle-Aquitaine, FranciaEl barrio de Helbarron forma parte del municipio de Saint Pée sur nivelle pero limita con Ascain .Mostrar más"
970472723258979546,gîte Lazuli  - 3*-,"Alojamiento entero: casa rural en Tuzaguet, Francia",6 viajeros ·  · 3 dormitorios ·  · 4 camas ·  · 1 baño,32 evaluaciones,Cabañas,,https://www.airbnb.es/rooms/53005399?adults=1&category_tag=Tag%3A5348&children=0&enable_m3_private_room=true&infants=0&pets=0&photo_id=1276359376&search_mode=flex_destinations_search&check_in=2024-03-21&check_out=2024-03-26&source_impression_id=p3_1710967236_aUqPwFDDWGPAKo8S&previous_page_section_name=1000,"Limpieza5,0","Veracidad5,0","Llegada5,0","Comunicación5,0","Ubicación4,9","Calidad5,0",CocinaWifiZona para trabajarAparcamiento gratuito en las instalacionesLavadoraPatio trasero privadoParque/cunas de viaje: disponible previa solicitudTrona: disponible previa solicitudSecador de peloNo disponible: Detector de monóxido de carbonoDetector de monóxido de carbonoMostrar los 41 servicios,"Tuzaguet, Occitanie, Francia"
4449149586854149195,Casa en Navacerrada con encanto y  bonitas vistas,"Alojamiento entero: chalet en Navacerrada, España","16 huéspedes o más ·  · 8 dormitorios ·  · 11 camas ·  · 3,5 baños",99 evaluaciones,Cabañas,299 € ,https://www.airbnb.es/rooms/39570597?adults=1&category_tag=Tag%3A5348&children=0&enable_m3_private_room=true&infants=0&pets=0&photo_id=927921889&search_mode=flex_destinations_search&check_in=2024-04-29&check_out=2024-05-04&source_impression_id=p3_1710967235_R5kN6sQEFurWJpll&previous_page_section_name=1000,"Limpieza4,7","Veracidad4,9","Llegada4,9","Comunicación4,9","Ubicación4,9","Calidad4,7","Vistas al jardínVistas al lagoCocinaWifiZona para trabajarAparcamiento gratuito en las instalacionesPiscina: uso De uso privado, Exterior, disponible según la temporada, disponible las 24 horasAdmite mascotasNo disponible: Detector de monóxido de carbonoDetector de monóxido de carbonoNo disponible: Detector de humoDetector de humoMostrar los 59 servicios","Navacerrada, Comunidad de Madrid, EspañaLa casa está a 1 km de la plaza del pueblo en la parte alta del pueblo. Es un barrio con casas de piedra muy tranquilo ideal para desconectar de la ciudad con amigos o familiaMostrar más"
3583904080364756894,Chalet/Village Center: Cocoon 3 dormitorios /impresionantes vistas,"Alojamiento entero: piso en Saint-Lary-Soulan, Francia","8 viajeros ·  · 3 dormitorios ·  · 6 camas ·  · 2,5 baños",78 evaluaciones,Cabañas,,https://www.airbnb.es/rooms/33550850?adults=1&category_tag=Tag%3A5348&children=0&enable_m3_private_room=true&infants=0&pets=0&photo_id=767834516&search_mode=flex_destinations_search&check_in=2024-03-21&check_out=2024-03-26&source_impression_id=p3_1710967237_E6NfjPNrHLd6zEsb&previous_page_section_name=1000,"Limpieza4,7","Veracidad4,9","Llegada4,9","Comunicación5,0","Ubicación4,9","Calidad4,7","Vistas al perfil urbanoVistas al jardínPista de esquíCocinaWifi rápido (65 Mbps)Aparcamiento gratuito en la entrada dentro de la propiedad: 8 plazasJacuzzi compartido: disponible todo el año, disponible en un horario específicoTelevisión de alta definición de 43""Lavadora en el edificio (Gratis)Cámaras de seguridad en la propiedadMostrar los 69 servicios","Saint-Lary-Soulan, Occitanie, FranciaSaint-Lary es un pequeño pueblo muy dinámico, animado todo el año.Mercado eólico el sábado por la mañana, con productores y artesanos locales. No te lo pierdas: las verduras de Nicole & Raymond; los quesos de Dominique (el mejor trabajador de Francia), el pan de Olivier y mucho más.Destacan dos restaurantes: ""La Grange"" y ""Panam""Mostrar más"
4416865451383056497,❀❀Nido acogedor en Chalet con vistas al lago / Wifi❀❀,"Alojamiento entero: piso en Les Angles, Francia",6 viajeros ·  · 2 dormitorios ·  · 1 baño,47 evaluaciones,Cabañas,70 € ,https://www.airbnb.es/rooms/54133940?adults=1&category_tag=Tag%3A5348&children=0&enable_m3_private_room=true&infants=0&pets=0&photo_id=1414563872&search_mode=flex_destinations_search&check_in=2024-04-07&check_out=2024-04-12&source_impression_id=p3_1710967244_rtkSferg%2F971mHDz&previous_page_section_name=1000,"Limpieza4,5","Veracidad4,8","Llegada4,9","Comunicación4,9","Ubicación4,9","Calidad4,8","Vistas al lagoVistas a la montañaCocinaWifi (9 Mbps)Aparcamiento gratuito en las instalacionesTelevisión de alta definición de 150"" con NetflixLavadora en el alojamiento (Gratis)Secadora en el alojamiento (Gratis)BañeraNo disponible: Detector de monóxido de carbonoDetector de monóxido de carbonoMostrar los 56 servicios","Les Angles, Occitanie, FranciaZona residencialMostrar más"
-7991922353427624259,Chalet Porte-bonheur | Pie de las pistas | Vista,"Alojamiento entero: chalet en Mont-Dore, Francia",6 viajeros ·  · 3 dormitorios ·  · 3 camas ·  · 1 baño,56 evaluaciones,Cabañas,130 € ,https://www.airbnb.es/rooms/52375763?adults=1&category_tag=Tag%3A5348&children=0&enable_m3_private_room=true&infants=0&pets=0&photo_id=1257088683&search_mode=flex_destinations_search&check_in=2024-04-01&check_out=2024-04-06&source_impression_id=p3_1710967244_lAG6Iq27KJDQhPoo&previous_page_section_name=1000,"Limpieza4,6","Veracidad4,9","Llegada4,9","Comunicación4,8","Ubicación5,0","Calidad4,6","Vistas a la montañaPista de esquí (Cerca de los telesillas)CocinaWifiZona para trabajarAparcamiento gratuito en las instalacionesTelevisor de 43""Lavadora en el alojamiento (Gratis)Secadora en el alojamiento (Gratis)No disponible: Detector de monóxido de carbonoDetector de monóxido de carbonoMostrar los 45 servicios","Mont-Dore, Auvernia-Ródano-Alpes, FranciaEl chalet se encuentra al pie de las pistas y las montañas del Sancy a 200 metros del primer remonte del Mont Dore. Rodeado de un arroyo y sin vecinos, encontrará paz y serenidad.Mostrar más"
-8941189577706806860,Chalet de nieve en Parque Natural a 2000 metros,"Alojamiento entero: chalet en Setcases, España",10 viajeros ·  · 1 dormitorio ·  · 4 camas ·  · 1 baño,31 evaluaciones,Cabañas,130 € ,https://www.airbnb.es/rooms/44364759?adults=1&category_tag=Tag%3A5348&children=0&enable_m3_private_room=true&infants=0&pets=0&photo_id=1103976489&search_mode=flex_destinations_search&check_in=2024-03-24&check_out=2024-03-29&source_impression_id=p3_1710967239_Yfrro8Fx5MJPnqQu&previous_page_section_name=1000,"Limpieza4,7","Veracidad4,7","Llegada5,0","Comunicación5,0","Ubicación4,9","Calidad4,7","Vistas a la montañaVistas al vallePista de esquíCocinaZona para trabajarAparcamiento gratuito en las instalacionesAdmite mascotasTelevisión de alta definición de 32""No disponible: Detector de monóxido de carbonoDetector de monóxido de carbonoNo disponible: Detector de humoDetector de humoMostrar los 31 servicios","Setcases, Cataluña, EspañaEstamos aislados en las montañas, pero en la carretera. Hay electricidad disponible y los vientos más cercanos están a 2,5 km. El pueblo más cercano es Setcases, a 10 km., donde encontrarás tiendas y buenos restaurantes. A 20 km se encuentra Camprodón, el pueblo principal del valle. Puedes visitar el románico, disfrutar de la vida del pueblo y pasear por sus alrededoresMostrar más"
6611725895867949235,Casa del árbol del socorrista,"Casa del árbol en Capbreton, Francia",2 viajeros ·  · 1 dormitorio ·  · 1 cama ·  · 1 baño,410 evaluaciones,Cabañas,216 € ,https://www.airbnb.es/rooms/14831321?adults=1&category_tag=Tag%3A5348&children=0&enable_m3_private_room=true&infants=0&pets=0&photo_id=204814950&search_mode=flex_destinations_search&check_in=2024-03-24&check_out=2024-03-29&source_impression_id=p3_1710967240_ov7me0aOO5J9K29d&previous_page_section_name=1000,"Limpieza4,9","Veracidad4,9","Llegada4,9","Comunicación4,9","Ubicación4,9","Calidad4,6",WifiAparcamiento gratuito en las instalacionesPiscinaJacuzziAire acondicionadoPatio o balcónFrigoríficoDesayunoMostrar los 25 servicios,"Capbreton, Aquitaine-Limousin-Poitou-Charentes, Francia"
3961026289001303282,Quinta Cercas da Costa | Casa da Eira,"Alojamiento entero: vivienda en Vieira do Minho, Portugal","2 viajeros ·  · 1 dormitorio ·  · 1 cama ·  · 1,5 baños",59 evaluaciones,Cabañas,,https://www.airbnb.es/rooms/17139574?adults=1&category_tag=Tag%3A5348&children=0&enable_m3_private_room=true&infants=0&pets=0&photo_id=991112784&search_mode=flex_destinations_search&check_in=2024-03-23&check_out=2024-03-28&source_impression_id=p3_1710967237_lQgQFvUdh7XSDNnG&previous_page_section_name=1000,"Limpieza5,0","Veracidad4,9","Llegada4,8","Comunicación4,9","Ubicación4,8","Calidad4,9",CocinaWifiAparcamiento gratuito en las instalacionesPiscina De uso compartidoTelevisión con televisión por cable estándarLavadora en el alojamiento (Gratis)SecadoraAire acondicionadoNo disponible: Detector de monóxido de carbonoDetector de monóxido de carbonoNo disponible: Detector de humoDetector de humoMostrar los 43 servicios,"Vieira do Minho, Braga, PortugalRossas es un pueblo muy tranquilo y tranquilo en Vieira do Minho. Tiene un paisaje precioso y la gente es muy amable. Adjuntamos algunas fotos de las principales atracciones del barrio.Mostrar más"
139219708732779504,"🏡 La Cabaña  en Agroturismo Anziola, ralax total!🏡","Alojamiento entero: casa rural en Oiartzun, España",4 viajeros ·  · 1 dormitorio ·  · 2 camas ·  · 1 baño,106 evaluaciones,Cabañas,119 € ,https://www.airbnb.es/rooms/48277133?adults=1&category_tag=Tag%3A5348&children=0&enable_m3_private_room=true&infants=0&pets=0&photo_id=1136535002&search_mode=flex_destinations_search&check_in=2024-05-04&check_out=2024-05-09&source_impression_id=p3_1710967241_IRKlij1lye5m2yOv&previous_page_section_name=1000,"Limpieza4,7","Veracidad4,8","Llegada4,9","Comunicación4,9","Ubicación4,8","Calidad4,6",CocinaWifiAparcamiento gratuito en las instalacionesPiscina De uso compartidoAdmite mascotasTVLavadoraPatio o balcón (Compartida)No disponible: Detector de monóxido de carbonoDetector de monóxido de carbonoNo disponible: Detector de humoDetector de humoMostrar los 42 servicios,"Oiartzun, Euskadi, EspañaMostrar más"
-4087824903508651842,"Pequeña casa de madera,  entre Biarritz y Hossegor","Alojamiento entero: vivienda en Tarnos, Francia",4 viajeros ·  · 1 dormitorio ·  · 1 cama ·  · 1 baño,144 evaluaciones,Cabañas,85 € ,https://www.airbnb.es/rooms/47758396?adults=1&category_tag=Tag%3A5348&children=0&enable_m3_private_room=true&infants=0&pets=0&photo_id=1121484370&search_mode=flex_destinations_search&check_in=2024-04-07&check_out=2024-04-12&source_impression_id=p3_1710967223_ruqV4CBzZ0XXxe9P&previous_page_section_name=1000,"Limpieza5,0","Veracidad5,0","Llegada5,0","Comunicación5,0","Ubicación4,8","Calidad4,8",Vistas al jardínCocinaAparcamiento gratuito en las instalacionesAdmite mascotasTVAire acondicionado centralizadoPatio o balcón (privada)CunaParque/cunas de viajeNo disponible: Detector de monóxido de carbonoDetector de monóxido de carbonoMostrar los 29 servicios,"Tarnos, Nouvelle-Aquitaine, FranciaZona tranquila y residencial con madera en las cercanías.Mostrar más"
-7843512998668970045,La cabaña de Flo,"Alojamiento entero: chalet en Saint-Christophe, Francia",9 viajeros ·  · 3 dormitorios ·  · 5 camas ·  · 2 baños,115 evaluaciones,Cabañas,150 € ,https://www.airbnb.es/rooms/47299709?adults=1&category_tag=Tag%3A5348&children=0&enable_m3_private_room=true&infants=0&pets=0&photo_id=1113127485&search_mode=flex_destinations_search&check_in=2024-03-24&check_out=2024-03-29&source_impression_id=p3_1710967238_vaNMeWkuHRwmnXiK&previous_page_section_name=1000,"Limpieza4,9","Veracidad5,0","Llegada5,0","Comunicación5,0","Ubicación4,9","Calidad4,8","Vistas al jardínVistas al parqueCocinaWifiZona para trabajarAparcamiento gratuito en las instalacionesPiscina: uso De uso privado, Exterior, disponible según la temporada, disponible las 24 horasJacuzzi privadoAdmite mascotasTelevisión con ChromecastMostrar los 63 servicios","Saint-Christophe, Nouvelle-Aquitaine, FranciaAl pie del bosque de Chabrieres, el chalet se encuentra en una pequeña aldea sin vecinos. Estará en calma y disfrutará de los circuitos señalizados en bicicleta de montaña, Trail y a pie.Mostrar más"
5778400207526741149,Templo encaramado con jacuzzi,"Casa del árbol en Le Nizan, Francia",6 viajeros ·  · 2 dormitorios ·  · 4 camas ·  · 1 baño,95 evaluaciones,Cabañas,282 € ,https://www.airbnb.es/rooms/24259118?adults=1&category_tag=Tag%3A5348&children=0&enable_m3_private_room=true&infants=0&pets=0&photo_id=1266696976&search_mode=flex_destinations_search&check_in=2024-04-07&check_out=2024-04-12&source_impression_id=p3_1710967239_3KxpPp11%2Fah6oEIZ&previous_page_section_name=1000,,,,,,,Vistas al jardínVistas al parqueZona para trabajarAparcamiento gratuito en las instalacionesPiscina De uso compartidoJacuzzi privadoSauna CompartidaLavadoraPatio o balcón (privada)No disponible: Detector de monóxido de carbonoDetector de monóxido de carbonoMostrar los 43 servicios,"Le Nizan, Nouvelle-Aquitaine, FranciaDominio preservado cerca del parque natural de las Landas de Gascuña y en el corazón del campo de Aquitania, nuestro pequeño pueblo insólito de 10 hectáreas goza de una gran riqueza paisajística, donde los espacios de pradera se entremezclan con la densidad del bosque de Bazad. EcÔtelia es una mezcla sutil y equilibrada entre autenticidad, glamping, ecología y originalidad. Las cabañas están situadas en un parque arbolado y verde, accesibles por caminos peatonales y le ofrecen vistas del campo y del bosque. ¡Un alojamiento atípico que le permitirá vivir una escapada exitosa!Mostrar más"
