ID,Titulo,Descripcion Simple,Informacion,Evaluaciones,Tipo,Precio,URL,Limpieza,Veracidad,Llegada,Comunicacion,Ubicacion,Calidad,Servicios,Localizacion
-6946822526334602168,Habitación en la naturaleza de la Pedriza,"Habitación en Manzanares el Real, España",1 cama de matrimonio ·  · Baño compartido,12 evaluaciones,En el campo,95 € ,https://www.airbnb.es/rooms/662089385227025526?adults=1&category_tag=Tag%3A4104&children=0&enable_m3_private_room=true&infants=0&pets=0&photo_id=1437701800&search_mode=flex_destinations_search&check_in=2024-05-27&check_out=2024-06-01&source_impression_id=p3_1710967207_mG2v3jD2dP5iyk8y&previous_page_section_name=1000,"Limpieza4,2","Veracidad4,6","Llegada4,8","Comunicación4,9","Ubicación4,8","Calidad4,6",CocinaZona para trabajarAparcamiento gratuito en las instalacionesAdmite mascotasTVLavadoraPatio traseroNo disponible: Cerradura en la puerta del dormitorioCerradura en la puerta del dormitorioNo disponible: Detector de monóxido de carbonoDetector de monóxido de carbonoNo disponible: Detector de humoDetector de humoMostrar los 14 servicios,"Manzanares el Real, Comunidad de Madrid, España"
-4872613769681739380,Villa Olivia,"Alojamiento entero: vivienda en El Casar, España",5 viajeros ·  · 2 dormitorios ·  · 4 camas ·  · 2 baños,6 evaluaciones,En el campo,150 € ,https://www.airbnb.es/rooms/1012443808981380035?adults=1&category_tag=Tag%3A4104&children=0&enable_m3_private_room=true&infants=0&pets=0&photo_id=1769206764&search_mode=flex_destinations_search&check_in=2024-05-24&check_out=2024-05-29&source_impression_id=p3_1710967198_GA039XZvm0ORPg%2FP&previous_page_section_name=1000,"Limpieza4,8","Veracidad4,8","Llegada5,0","Comunicación5,0","Ubicación4,8","Calidad4,5",Vistas al valleCocinaWifiAparcamiento gratuito en las instalacionesAdmite mascotasTVLavadoraSecadoraNo disponible: Detector de monóxido de carbonoDetector de monóxido de carbonoNo disponible: Detector de humoDetector de humoMostrar los 46 servicios,"El Casar, Castilla-La Mancha, España"
-14186533122971049,Preciosa casa rural - El Espinar,"Alojamiento entero: vivienda en La Estación de El Espinar, España",6 viajeros ·  · 3 dormitorios ·  · 4 camas ·  · 2 baños,169 evaluaciones,En el campo,,https://www.airbnb.es/rooms/1044782993298746129?adults=1&category_tag=Tag%3A4104&children=0&enable_m3_private_room=true&infants=0&pets=0&photo_id=1846342931&search_mode=flex_destinations_search&check_in=2024-03-22&check_out=2024-03-27&source_impression_id=p3_1710967201_bYr3BedBiGXpGuoQ&previous_page_section_name=1000,,,,,,,CocinaWifiZona para trabajarAdmite mascotasTVLavadoraChimenea interiorBrasero exteriorNo disponible: Detector de monóxido de carbonoDetector de monóxido de carbonoNo disponible: Detector de humoDetector de humoMostrar los 12 servicios,"La Estación de El Espinar, Castilla y León, España"
6601228082481051149,Casa rural las Herreras 1,"Alojamiento entero: casa rural en Las Herreras, España",8 viajeros ·  · 4 dormitorios ·  · 8 camas ·  · 2 baños,44 evaluaciones,En el campo,228 € ,https://www.airbnb.es/rooms/577537969844913789?adults=1&category_tag=Tag%3A4104&children=0&enable_m3_private_room=true&infants=0&pets=0&photo_id=1831870973&search_mode=flex_destinations_search&check_in=2024-03-31&check_out=2024-04-05&source_impression_id=p3_1710967204_t%2FT9RzFRxKVxaAim&previous_page_section_name=1000,"Limpieza4,6","Veracidad4,8","Llegada4,8","Comunicación4,8","Ubicación4,8","Calidad4,6","Vistas a la montañaCocinaWifiAparcamiento gratuito en la callePiscina: uso De uso privado, Exterior, disponible según la temporada, disponible las 24 horasJacuzzi privado: disponible todo el añoAdmite mascotasTelevisión de alta definiciónNo disponible: Detector de monóxido de carbonoDetector de monóxido de carbonoNo disponible: Detector de humoDetector de humoMostrar los 48 servicios","Las Herreras, Comunidad de Madrid, España"
-8445720609291419161,"Villa de 8 habitaciones, piscina, barbacoa y cueva","Alojamiento entero: vivienda en Nuevo Baztán, España",16 huéspedes o más ·  · 8 dormitorios ·  · 13 camas ·  · 3 baños,4 evaluaciones,En el campo,309 € ,https://www.airbnb.es/rooms/1047280419762243030?adults=1&category_tag=Tag%3A4104&children=0&enable_m3_private_room=true&infants=0&pets=0&photo_id=1802236660&search_mode=flex_destinations_search&check_in=2024-03-24&check_out=2024-03-29&source_impression_id=p3_1710967204_mlM7Jt8ey0iL3Z2G&previous_page_section_name=1000,"Limpieza4,8","Veracidad4,8","Llegada5,0","Comunicación5,0","Ubicación5,0","Calidad4,5","CocinaWifiZona para trabajarAparcamiento gratuito en un garaje residencial en la propiedad: 10 plazasPiscina: uso De uso privado, Exterior, disponible según la temporada, disponible en un horario específico, cubierta de piscina, juguetes para piscinaJacuzzi privadoAdmite mascotasCámaras de seguridad en la propiedadNo disponible: Detector de monóxido de carbonoDetector de monóxido de carbonoNo disponible: Detector de humoDetector de humoMostrar los 53 servicios","Nuevo Baztán, Comunidad de Madrid, EspañaLa urbanización Eurovillas de Nuevo Baztán ofrece una amplia variedad de actividades al aire libre, como senderismo, ciclismo y paseos a caballo, para aquellos que deseen disfrutar de la naturaleza. Además, está cerca de la histórica localidad de Nuevo Baztán, con sus encantadoras calles empedradas y su patrimonio arquitectónico.En resumen, nuestro chalet en la urbanización Eurovillas de Nuevo Baztán es el destino perfecto para aquellos que buscan descanso y tranquilidad en un entorno natural. No dude en contactarnos para hacer su reserva y asegurarse unas vacaciones inolvidables. ¡Le esperamos con los brazos abiertos!Mostrar más"
-4480529635376479031,El Pinsapo,"Casa particular en La Estación de El Espinar, España",7 viajeros ·  · 2 dormitorios ·  · 7 camas ·  · 2 baños,15 evaluaciones,En el campo,93 € ,https://www.airbnb.es/rooms/853613543893153466?adults=1&category_tag=Tag%3A4104&children=0&enable_m3_private_room=true&infants=0&pets=0&photo_id=1676778696&search_mode=flex_destinations_search&check_in=2024-03-20&check_out=2024-03-25&source_impression_id=p3_1710967206_%2B%2FqcPV0m4Jyd1jKq&previous_page_section_name=1000,"Limpieza4,5","Veracidad4,7","Llegada4,8","Comunicación4,9","Ubicación4,8","Calidad4,7","Vistas al jardínVistas a la montañaCocinaWifiZona para trabajarAparcamiento gratuito en las instalacionesAdmite mascotasTelevisión de alta definición de 60""No disponible: Detector de monóxido de carbonoDetector de monóxido de carbonoNo disponible: Detector de humoDetector de humoMostrar los 39 servicios","La Estación de El Espinar, Castilla y León, Españaes una pedania muy tranquila perteneciente a el espinar. dispone de estacion de tren y autobus  a madrid. es un enclave muy tranquilo pues no tiene carretera como San Rafael ni su bullicio , pero esta solo a 7 min de esta. a los pies de las montañas, en su cara norte con un microclima que en pleno agosto muy raramente supera los 30grados!! y por las noches baja hasta los 10 grados!!! olvidate del aire acondicionado!!. hay un rio con agua permanente y bosque de abetos con mucha humedad , te parecera estar en el norte . el area de la panera tiene piscinas naturales y un paseo precioso para los que les guste andar hasta dos embalses desconocidos por bosques alpinos, embalses llamados Del Tejo.Tiene pistas de tenis, padel , futbol...de hecho es famoso por celebrarse en Julio el torneo internacional de tenis de castilla y leon.a 20 min de la Granja de San Ildefonso y su palacio y jardines y 30 min a Segovia.Mostrar más"
-3279383283905700298,Casa con piscina en San Rafael. El Jardín de Luisa,"Alojamiento entero: vivienda en El Espinar, España",15 viajeros ·  · 5 dormitorios ·  · 11 camas ·  · 3 baños,5 evaluaciones,En el campo,310 € ,https://www.airbnb.es/rooms/864942999914329074?adults=1&category_tag=Tag%3A4104&children=0&enable_m3_private_room=true&infants=0&pets=0&photo_id=1623647639&search_mode=flex_destinations_search&check_in=2024-04-07&check_out=2024-04-12&source_impression_id=p3_1710967198_%2FNDzgxAjSnarWGq5&previous_page_section_name=1000,"Limpieza4,8","Veracidad5,0","Llegada5,0","Comunicación5,0","Ubicación4,8","Calidad4,6",Vistas a la montañaCocinaWifiZona para trabajarAparcamiento gratuito en las instalacionesPiscina De uso privadoAdmite mascotasTVNo disponible: Detector de monóxido de carbonoDetector de monóxido de carbonoNo disponible: Detector de humoDetector de humoMostrar los 69 servicios,"El Espinar, Castilla y León, EspañaEl entorno es muy tranquilo, y se encuentra a 300 metros del centro del puebloMostrar más"
-1387034592995746411,HABITACIÓN  PARA UNA PERSONA EN ALPEDRETE,"Habitación en Alpedrete, España",1 cama individual ·  · Baño compartido,7 evaluaciones,En el campo,49 € ,https://www.airbnb.es/rooms/23817399?adults=1&category_tag=Tag%3A4104&children=0&enable_m3_private_room=true&infants=0&pets=0&photo_id=463844992&search_mode=flex_destinations_search&check_in=2024-04-01&check_out=2024-04-06&source_impression_id=p3_1710967195_GpzQUpdQbezsaSDC&previous_page_section_name=1000,"Limpieza5,0","Veracidad5,0","Llegada5,0","Comunicación5,0","Ubicación4,9","Calidad4,9","Cerradura en la puerta del dormitorioCocinaWifiAparcamiento gratuito en la calleTelevisión de alta definición de 32""Lavadora en el alojamiento (Gratis)Secadora en el alojamiento (Gratis)Aire acondicionado centralizadoNo disponible: Detector de monóxido de carbonoDetector de monóxido de carbonoNo disponible: Detector de humoDetector de humoMostrar los 50 servicios","Alpedrete, Comunidad de Madrid, EspañaUrbanización  muy tranquila y segura, con fácil aparcamiento, la casa esta rodeada de una dehesa donde poder ir hacer deporte, senderismo, rutas en bicicleta, etc..Mostrar más"
8814612923513009256,"Casa Sierra norte de Madrid ""Green Cottage""","Alojamiento entero: vivienda en Galapagar, España","8 viajeros ·  · 4 dormitorios ·  · 6 camas ·  · 2,5 baños",34 evaluaciones,En el campo,181 € ,https://www.airbnb.es/rooms/844676701896269452?adults=1&category_tag=Tag%3A4104&children=0&enable_m3_private_room=true&infants=0&pets=0&photo_id=1627550436&search_mode=flex_destinations_search&check_in=2024-03-31&check_out=2024-04-05&source_impression_id=p3_1710967206_yFA9glAtLMNWoTbV&previous_page_section_name=1000,"Limpieza4,6","Veracidad4,7","Llegada4,8","Comunicación5,0","Ubicación4,8","Calidad4,8",CocinaWifiZona para trabajarAparcamiento gratuito en las instalacionesPiscina De uso compartidoAdmite mascotasTVLavadoraNo disponible: Detector de monóxido de carbonoDetector de monóxido de carbonoNo disponible: Detector de humoDetector de humoMostrar los 16 servicios,"Galapagar, Comunidad de Madrid, España"
2579876533344961581,HERMOSO CHALET BOADILLA DEL MONTE,"Habitación en Boadilla del Monte, España",3 dormitorios ·  · 3 camas ·  · Baño compartido,15 evaluaciones,En el campo,150 € ,https://www.airbnb.es/rooms/27335044?adults=1&category_tag=Tag%3A4104&children=0&enable_m3_private_room=true&infants=0&pets=0&photo_id=591309261&search_mode=flex_destinations_search&check_in=2024-12-01&check_out=2024-12-06&source_impression_id=p3_1710967195_aNVRr24KljszjRUr&previous_page_section_name=1000,,,,,,,CocinaWifiAparcamiento gratuito en las instalacionesPiscinaTelevisión con televisión por cable estándarLavadoraSecadoraPatio o balcónNo disponible: Cerradura en la puerta del dormitorioCerradura en la puerta del dormitorioNo disponible: Detector de monóxido de carbonoDetector de monóxido de carbonoMostrar los 37 servicios,"Boadilla del Monte, Comunidad de Madrid, EspañaBarrio muy tranquilo, urbanización con vigilancia las 24 horas.Zona ideal  para hacer Mountain bike y senderismo , jugar golf , hipica. Muy cerca tiene  centros comerciales y outlets , como el de las Rozas Village entre otrosEn el barrio están algunos de los mejores colegios bilingues  de Madrid, como el Trinity, el Saint Michael School y el Mirabal, muy cercanas  están  la Universidad Europea de Madrid,  la Universidad CEU San Pablo Monteprincipe,  entre  otras.Mostrar más"
-2414439583146842753,Casa con piscina y amplio jardín,"Alojamiento entero: vivienda en Villaviciosa de Odón, España",6 viajeros ·  · 3 dormitorios ·  · 3 camas ·  · 3 baños,2 evaluaciones,En el campo,190 € ,https://www.airbnb.es/rooms/950665676358251617?adults=1&category_tag=Tag%3A4104&children=0&enable_m3_private_room=true&infants=0&pets=0&photo_id=1712834907&search_mode=flex_destinations_search&check_in=2024-04-29&check_out=2024-05-04&source_impression_id=p3_1710967200_Ujs%2BsRQoGmseJZAz&previous_page_section_name=1000,,,,,,,CocinaWifiAparcamiento gratuito en la callePiscinaTVLavadoraAire acondicionadoCámaras de seguridad en la propiedadNo disponible: Detector de monóxido de carbonoDetector de monóxido de carbonoNo disponible: Detector de humoDetector de humoMostrar los 29 servicios,"Villaviciosa de Odón, Comunidad de Madrid, España"
8211373909775178827,El Ciprés de Valdeprados,"Alojamiento entero: casa rural en Valdeprados, España","12 viajeros ·  · 5 dormitorios ·  · 11 camas ·  · 5,5 baños",6 evaluaciones,En el campo,503 € ,https://www.airbnb.es/rooms/962834223525274821?adults=1&category_tag=Tag%3A4104&children=0&enable_m3_private_room=true&infants=0&pets=0&photo_id=1723598119&search_mode=flex_destinations_search&check_in=2024-06-24&check_out=2024-06-30&source_impression_id=p3_1710967197_yrtJCziUMOu3cKd%2B&previous_page_section_name=1000,"Limpieza5,0","Veracidad5,0","Llegada4,8","Comunicación5,0","Ubicación5,0","Calidad5,0","Vistas al patioVistas a la montañaCocinaWifiAparcamiento gratuito en las instalacionesPiscina: uso De uso privado, Exterior, disponible según la temporada, disponible las 24 horas, cubierta de piscina, de agua saladaTelevisión de alta definición de 55"" con televisión por cable estándarLavadora en el alojamiento (Gratis)Aire acondicionado centralizadoCámaras de seguridad en la propiedadMostrar los 61 servicios","Valdeprados, Castilla y León, España"
-3903408206366961685,A6) Habitación Privada 4 Prs. 10 min Centro Madrid,"Habitación en Pozuelo de Alarcón, España",2 camas de matrimonio ·  · Baño compartido,87 evaluaciones,En el campo,64 € ,https://www.airbnb.es/rooms/53990011?adults=1&category_tag=Tag%3A4104&children=0&enable_m3_private_room=true&infants=0&pets=0&photo_id=1446245734&search_mode=flex_destinations_search&check_in=2024-04-14&check_out=2024-04-19&source_impression_id=p3_1710967206_fWQ%2FQFAm0GKZi7wp&previous_page_section_name=1000,"Limpieza4,8","Veracidad4,7","Llegada4,9","Comunicación4,8","Ubicación4,7","Calidad4,7","Cerradura en la puerta del dormitorioVistas al jardínCocinaWifiZona para trabajarAparcamiento gratuito en las instalacionesTelevisión de alta definición de 50"" con NetflixPatio o balcón (Compartida)Cámaras de seguridad en la propiedadNo disponible: Detector de monóxido de carbonoDetector de monóxido de carbonoMostrar los 51 servicios","Pozuelo de Alarcón, Comunidad de Madrid, EspañaPozuelo de Alarcón es una de las zonas de mayores ingreso de toda españa.  Y es una zona residencial de mucha discreción y silencio.  Es una zona estudiantil por excelencia. Hay muchos colegios y universidades cerca. Sin embargo estamos muy cerca de todos los servicios del centro de la ciudad sin sus desventajas.   Puedes encontrar todo tipo de servicios que puedes llegar caminando en un par de minutos.  Lllegar al centro en metro solo cueta 1,30m euros asi que bien vale la pena quedarse y pagar mucho menos que en otros lados.Mostrar más"
-5575294575994998013,La Yurta de Gaia,"Yurta en San Lorenzo de El Escorial, España",4 viajeros ·  · 1 dormitorio ·  · 3 camas ·  · 1 baño,2 evaluaciones,En el campo,65 € ,https://www.airbnb.es/rooms/639105814853228546?adults=1&category_tag=Tag%3A4104&children=0&enable_m3_private_room=true&infants=0&pets=0&photo_id=1423275845&search_mode=flex_destinations_search&check_in=2024-04-07&check_out=2024-04-12&source_impression_id=p3_1710967201_maQK5zTlPYi7wkZQ&previous_page_section_name=1000,,,,,,,Vistas al jardínVistas a la montañaAcceso al lagoCocinaZona para trabajarAparcamiento gratuito en las instalacionesAdmite mascotasPatio o balcónNo disponible: Detector de monóxido de carbonoDetector de monóxido de carbonoNo disponible: Detector de humoDetector de humoMostrar los 33 servicios,"San Lorenzo de El Escorial, Comunidad de Madrid, EspañaEl alojamiento se encuentra en plena Sierra de Guadarrama, donde se pueden realizar numerosas rutas de senderismo o cicloturismo. Al lado de la finca hay un pequeño lago en el que refrescarse en verano.Enclaves cercanos para visitar son: El monte Abantos, el Bosque de la Herrería, La Casita del Príncipe, El Monasterio del Escorial, el Embalse de la Jarosa, etc.Si quieren desplazarse en coche, a unos 25 minutos se encuentra la villa de El Escorial con numerosas actividades culturales y restaurantes.Mostrar más"
-4410351912950176406,Fantástica Cabaña de madera,"Alojamiento entero: cabaña en La Estación, España",2 viajeros ·  · 1 dormitorio ·  · 1 cama ·  · 1 baño,,En el campo,,https://www.airbnb.es/rooms/1106986203464657361?adults=1&category_tag=Tag%3A4104&children=0&enable_m3_private_room=true&infants=0&pets=0&photo_id=1856296973&search_mode=flex_destinations_search&check_in=2024-03-20&check_out=2024-03-25&source_impression_id=p3_1710967195_jrU28ayoOWh8r5jx&previous_page_section_name=1000,,,,,,,CocinaWifiZona para trabajarAparcamiento gratuito en las instalacionesAdmite mascotasTVAire acondicionadoChimenea interiorNo disponible: Detector de monóxido de carbonoDetector de monóxido de carbonoNo disponible: Detector de humoDetector de humoMostrar los 9 servicios,"La Estación, Comunidad de Madrid, España"
5580706453351614893,Preciosa Casa  Parque Natural Sierra Guadarrama*,"Alojamiento entero: casa rural en Cercedilla, España","5 viajeros ·  · 3 dormitorios ·  · 3 camas ·  · 1,5 baños",23 evaluaciones,En el campo,90 € ,https://www.airbnb.es/rooms/45835347?adults=1&category_tag=Tag%3A4104&children=0&enable_m3_private_room=true&infants=0&pets=0&photo_id=1080992954&search_mode=flex_destinations_search&check_in=2024-03-30&check_out=2024-04-05&source_impression_id=p3_1710967206_uoLf3XvFanhY05t4&previous_page_section_name=1000,"Limpieza4,2","Veracidad4,7","Llegada4,5","Comunicación4,8","Ubicación5,0","Calidad4,5",Vistas al patioVistas al jardínCocinaWifiAparcamiento gratuito en la calleTVLavadora en el edificio (Gratis)BañeraNo disponible: Detector de monóxido de carbonoDetector de monóxido de carbonoNo disponible: Detector de humoDetector de humoMostrar los 42 servicios,"Cercedilla, Comunidad de Madrid, España"
1775999145173128778,Cabaña acogedora,"Alojamiento entero: cabaña en Valdemorillo, España",4 viajeros ·  · 2 dormitorios ·  · 3 camas ·  · 1 baño,4 evaluaciones,En el campo,105 € ,https://www.airbnb.es/rooms/1003380053290273374?adults=1&category_tag=Tag%3A4104&children=0&enable_m3_private_room=true&infants=0&pets=0&photo_id=1761065943&search_mode=flex_destinations_search&check_in=2024-03-30&check_out=2024-04-04&source_impression_id=p3_1710967207_pgpw1wFm6VAqy0rI&previous_page_section_name=1000,"Limpieza4,8","Veracidad4,8","Llegada4,8","Comunicación4,8","Ubicación4,5","Calidad4,8",CocinaWifiZona para trabajarAparcamiento gratuito en las instalacionesPiscinaTVLavadoraAire acondicionadoNo disponible: Detector de monóxido de carbonoDetector de monóxido de carbonoNo disponible: Detector de humoDetector de humoMostrar los 45 servicios,"Valdemorillo, Comunidad de Madrid, España"
3652325859855430294,Tranquilidad y encanto en Casa taller de flores,"Habitación en Torrelodones, España",1 cama de matrimonio grande ·  · Baño privado en el alojamiento,136 evaluaciones,En el campo,60 € ,https://www.airbnb.es/rooms/33521400?adults=1&category_tag=Tag%3A4104&children=0&enable_m3_private_room=true&infants=0&pets=0&photo_id=731048444&search_mode=flex_destinations_search&check_in=2024-04-01&check_out=2024-04-06&source_impression_id=p3_1710967198_Vl6mkKLuKyP4T6dS&previous_page_section_name=1000,"Limpieza4,9","Veracidad5,0","Llegada5,0","Comunicación5,0","Ubicación4,8","Calidad5,0","CocinaWifiZona para trabajarAparcamiento gratuito en las instalacionesPiscina: uso De uso privado, Exterior, Admite mascotasLavadora en el edificio (Gratis)No disponible: Cerradura en la puerta del dormitorioCerradura en la puerta del dormitorioNo disponible: Detector de monóxido de carbonoDetector de monóxido de carbonoNo disponible: Detector de humoDetector de humoMostrar los 48 servicios","Torrelodones, Comunidad de Madrid, EspañaNuestro barrio es muy, muy tranquilo. Paseos por el monte, lectura, siesta........pero a 15´ andando, tienes buen ambiente.Mostrar más"
-1273853420322379068,Chalet el Los Ángeles de San Rafael,"Alojamiento entero: vivienda en Los Ángeles de San Rafael, España",5 viajeros ·  · 2 dormitorios ·  · 3 camas ·  · 3 baños,30 evaluaciones,En el campo,81 € ,https://www.airbnb.es/rooms/959495230299870981?adults=1&category_tag=Tag%3A4104&children=0&enable_m3_private_room=true&infants=0&pets=0&photo_id=1728994242&search_mode=flex_destinations_search&check_in=2024-04-02&check_out=2024-04-07&source_impression_id=p3_1710967205_W8%2Bjb0DnVkiX2N3n&previous_page_section_name=1000,"Limpieza4,7","Veracidad4,7","Llegada4,8","Comunicación4,7","Ubicación4,6","Calidad4,7",Vistas a la montañaCocinaWifiZona para trabajarAparcamiento gratuito en las instalacionesAdmite mascotasLavadora en el alojamiento (Gratis)Aire acondicionado centralizadoBañeraNo disponible: Detector de humoDetector de humoMostrar los 31 servicios,"Los Ángeles de San Rafael, Segovia, España"
-112831145928566521,Hermosa Casa de Campo en Chinchón,"Alojamiento entero: villa en Chinchón, España","6 viajeros ·  · 3 dormitorios ·  · 4 camas ·  · 2,5 baños",9 evaluaciones,En el campo,,https://www.airbnb.es/rooms/27258907?adults=1&category_tag=Tag%3A4104&children=0&enable_m3_private_room=true&infants=0&pets=0&photo_id=547662603&search_mode=flex_destinations_search&check_in=2024-03-22&check_out=2024-03-27&source_impression_id=p3_1710967183_bkhvszo9FGJS2xoh&previous_page_section_name=1000,"Limpieza5,0","Veracidad5,0","Llegada4,9","Comunicación5,0","Ubicación4,8","Calidad4,8",CocinaWifiAparcamiento gratuito en las instalacionesPiscina De uso privadoAdmite mascotasTVLavadoraCámaras de seguridad en la propiedadNo disponible: Detector de monóxido de carbonoDetector de monóxido de carbonoNo disponible: Detector de humoDetector de humoMostrar los 40 servicios,"Chinchón, Comunidad de Madrid, EspañaTendrán las comodidades de un hogar, y una casa de campo, alejada de la civilización para despejarse del día a día, y tener unas vacaciones maravillosas.Mostrar más"
-2847256410499284653,Casa de madera en plena naturaleza,"Alojamiento entero: vivienda en San Agustín de Guadalix, España",5 viajeros ·  · 2 dormitorios ·  · 4 camas ·  · 1 baño,111 evaluaciones,En el campo,123 € ,https://www.airbnb.es/rooms/13140041?adults=1&category_tag=Tag%3A4104&children=0&enable_m3_private_room=true&infants=0&pets=0&photo_id=604211854&search_mode=flex_destinations_search&check_in=2024-07-01&check_out=2024-07-06&source_impression_id=p3_1710967203_X6%2BysrDngVJPJKYC&previous_page_section_name=1000,"Limpieza4,5","Veracidad4,8","Llegada4,9","Comunicación5,0","Ubicación4,9","Calidad4,7",CocinaWifiAparcamiento gratuito en las instalacionesAdmite mascotasTVLavadoraAire acondicionadoPatio o balcón (privada)No disponible: Detector de monóxido de carbonoDetector de monóxido de carbonoNo disponible: Detector de humoDetector de humoMostrar los 46 servicios,"San Agustín de Guadalix, Madrid, EspañaLa finca se encuentra a 2 km del pueblo de San Agustín de Guadalix en el que puedes encontrar diferentes restaurantes ,supermercados etc.Mostrar más"
580117112909997967,Cómoda y iluminada habitación,"Habitación en Colmenarejo, España",1 cama ·  · Baño privado en el alojamiento,2 evaluaciones,En el campo,,https://www.airbnb.es/rooms/902643962504196077?adults=1&category_tag=Tag%3A4104&children=0&enable_m3_private_room=true&infants=0&pets=0&photo_id=1663068377&search_mode=flex_destinations_search&check_in=2024-03-21&check_out=2024-03-26&source_impression_id=p3_1710967195_3o5bzA0db3oS6tJM&previous_page_section_name=1000,,,,,,,Acceso al lagoCocinaWifiZona para trabajarAparcamiento gratuito en las instalacionesAdmite mascotasLavadoraCámaras de seguridad en la propiedadNo disponible: Cerradura en la puerta del dormitorioCerradura en la puerta del dormitorioNo disponible: Detector de monóxido de carbonoDetector de monóxido de carbonoMostrar los 54 servicios,"Colmenarejo, Comunidad de Madrid, EspañaEstamos en medio a la naturaleza a 4 min del pueblo en coche o 25 min caminando, acerca del pantano de ValmayorMostrar más"
